{
  "id": "1",
  "loc_id": "9",
  "order_id": "1",
  "item": "Dynamite",
  "price": "15",
  "quantity": "1",
  "options": "Shark - Bacon - Cheese",
  "special": "",
  "modify_price": "",
  "print": "1",
  "check": "1",
  "seat": "1",
  "item_id": "120",
  "printer": "1",
  "apply_taxrate": "0.06875",
  "custom_taxrate": "0.06875",
  "modifier_list_id": "0",
  "forced_modifier_group_id": "0",
  "forced_modifiers_price": "5.25",
  "course": "1",
  "print_order": "0",
  "open_item": "0",
  "subtotal": "",
  "allow_deposit": "0",
  "deposit_info": "",
  "discount_amount": "",
  "discount_value": "",
  "discount_type": "",
  "after_discount": "",
  "subtotal_with_mods": "",
  "tax_amount": "",
  "notes": "",
  "total_with_tax": "",
  "itax_rate": "",
  "itax": "",
  "tax_rate1": "",
  "tax1": "",
  "tax_rate2": "",
  "tax2": "",
  "tax_rate3": "",
  "tax3": ""
}